{
  "schema_version": 1,
  "corpus_id": "shadowbane.behavior-corpus.v1",
  "reviewed_on": "2026-08-29",
  "profiles": [
    {
      "profile_id": "retail-final-24.3",
      "label": "Shadowbane retail final patch 24.3",
      "kind": "retail",
      "description": "Historical retail behavior after the final official January 7, 2009 patch. This is an evidence target, not an assumption that any current emulator matches it.",
      "inherits_from": null,
      "valid_from": "2009-01-07",
      "valid_to": null,
      "status": "historical"
    },
    {
      "profile_id": "magicbane-ab96cfc",
      "label": "MagicBane server at ab96cfc",
      "kind": "emulator",
      "description": "Public MagicBane server implementation pinned to the same commit used by the current ruleset. Concrete deployment power/effect rows are not included in the public source checkout.",
      "inherits_from": null,
      "valid_from": null,
      "valid_to": null,
      "status": "active"
    },
    {
      "profile_id": "wonderbane-observed",
      "label": "WonderBane.com live service",
      "kind": "observed_runtime",
      "description": "The official live Shadowbane emulator service at https://wonderbane.com used by the lab. The target service is identified, but exact client release hashes, patcher state, server implementation lineage, deployment data and runtime configuration still require fingerprinting.",
      "inherits_from": null,
      "valid_from": null,
      "valid_to": null,
      "status": "active"
    },
    {
      "profile_id": "sbe-2015-1.5",
      "label": "Shadowbane Emulator Patch 1.5 (2015)",
      "kind": "alternate_server",
      "description": "A later emulator patch dialect with custom balance changes. Its patch numbering must not be confused with retail Patch 1.5.",
      "inherits_from": null,
      "valid_from": "2015-07-16",
      "valid_to": null,
      "status": "historical"
    },
    {
      "profile_id": "reference-lab-v1",
      "label": "Shadowbane Lab reference model v1",
      "kind": "lab_model",
      "description": "The deliberately simplified deterministic model used for protocol, engine and policy experiments. Approximations belong here unless promoted by profile-specific evidence.",
      "inherits_from": null,
      "valid_from": "2026-08-25",
      "valid_to": null,
      "status": "reference_only"
    }
  ],
  "sources": [
    {
      "source_id": "magicbane-server-ab96cfc",
      "label": "MagicBane Server revision ab96cfc",
      "kind": "emulator_source",
      "authority": "primary_implementation",
      "profiles": [
        "magicbane-ab96cfc"
      ],
      "uri": "https://repo.magicbane.com/MagicBane/Server/src/commit/ab96cfcda4e983dd7fc1fc205205810f11ddd3de",
      "revision": "ab96cfcda4e983dd7fc1fc205205810f11ddd3de",
      "retrieved_on": "2026-08-29",
      "scope": [
        "server implementation",
        "power execution",
        "effect modifiers",
        "combat",
        "movement",
        "AI",
        "items",
        "world systems"
      ],
      "limitations": [
        "The public source checkout does not contain the concrete deployment power/effect rows required to bind every token and numeric value.",
        "Implementation behavior describes this emulator profile, not automatically final retail or WonderBane."
      ],
      "ingestion": {
        "method": "git_snapshot",
        "automatable": true,
        "available": true,
        "notes": "Index by commit, path, symbol and line range. Preserve the repository's own history as a separate source."
      },
      "capture_status": "remote_pinned",
      "snapshot_path": null,
      "content_sha256": null,
      "content_type": "text/html"
    },
    {
      "source_id": "magicbane-server-history",
      "label": "MagicBane Server commit history",
      "kind": "version_control_history",
      "authority": "primary_implementation",
      "profiles": [
        "magicbane-ab96cfc"
      ],
      "uri": "https://repo.magicbane.com/MagicBane/Server/commits/branch/master",
      "revision": "discovery index retrieved 2026-08-29",
      "retrieved_on": "2026-08-29",
      "scope": [
        "implementation change history",
        "bug-fix rationale",
        "behavior regressions"
      ],
      "limitations": [
        "Master history may contain changes after the pinned simulator target.",
        "Commit messages and diffs require behavior-level review before use."
      ],
      "ingestion": {
        "method": "git_history",
        "automatable": true,
        "available": true,
        "notes": "Use ancestry-relative history ending at the pinned commit for the profile; use later commits only as qualifying evidence."
      },
      "capture_status": "pending",
      "snapshot_path": null,
      "content_sha256": null,
      "content_type": "text/html"
    },
    {
      "source_id": "magicbane-patch-notes",
      "label": "MagicBane mirror of Shadowbane patch notes",
      "kind": "emulator_patch_notes",
      "authority": "primary_official",
      "profiles": [
        "retail-final-24.3",
        "magicbane-ab96cfc"
      ],
      "uri": "https://repo.magicbane.com/MagicBane/Server/wiki/Shadowbane-Patch-Notes",
      "revision": "wiki page revision 1, edited 2022-05-06",
      "retrieved_on": "2026-08-29",
      "scope": [
        "retail patch chronology",
        "intentional behavior changes",
        "edge-case fixes"
      ],
      "limitations": [
        "This is a community-hosted mirror, not the original Ubisoft publication endpoint.",
        "Patch intent does not prove that every target implementation matches it."
      ],
      "ingestion": {
        "method": "html_snapshot",
        "automatable": true,
        "available": true,
        "notes": "Split entries by dated retail patch and preserve exact section anchors or quoted issue identifiers."
      },
      "capture_status": "pending",
      "snapshot_path": null,
      "content_sha256": null,
      "content_type": "text/html"
    },
    {
      "source_id": "morloch-patch-history-33861",
      "label": "Morloch Patch History revision 33861",
      "kind": "wiki_revision",
      "authority": "secondary_reconstruction",
      "profiles": [
        "retail-final-24.3",
        "sbe-2015-1.5"
      ],
      "uri": "https://morloch.shadowbaneemulator.com/index.php?title=Patch_History&oldid=33861",
      "revision": "oldid=33861",
      "retrieved_on": "2026-08-29",
      "scope": [
        "retail/emulator era classification",
        "patch index",
        "patch dates"
      ],
      "limitations": [
        "The page mixes retail history and later emulator history; every referenced patch must be assigned to a profile before extraction."
      ],
      "ingestion": {
        "method": "mediawiki_revision",
        "automatable": true,
        "available": true,
        "notes": "Use oldid and crawl linked patch pages while retaining the era heading."
      },
      "capture_status": "remote_pinned",
      "snapshot_path": null,
      "content_sha256": null,
      "content_type": "text/html"
    },
    {
      "source_id": "morloch-patch-24.3-31885",
      "label": "Morloch mirror of official Patch 24.3",
      "kind": "official_patch_mirror",
      "authority": "primary_official",
      "profiles": [
        "retail-final-24.3"
      ],
      "uri": "https://morloch.shadowbaneemulator.com/index.php?title=Patch_24.3&oldid=31885",
      "revision": "oldid=31885",
      "retrieved_on": "2026-08-29",
      "scope": [
        "final retail behavior changes",
        "weapon power range",
        "Sneak",
        "Invisibility",
        "Passwall",
        "Backstab",
        "Shadow Mantle"
      ],
      "limitations": [
        "A final-patch change establishes the post-patch retail claim but does not identify emulator implementation code or all unchanged base mechanics."
      ],
      "ingestion": {
        "method": "mediawiki_revision",
        "automatable": true,
        "available": true,
        "notes": null
      },
      "capture_status": "remote_pinned",
      "snapshot_path": null,
      "content_sha256": null,
      "content_type": "text/html"
    },
    {
      "source_id": "morloch-power-34596",
      "label": "Morloch Power mechanics revision 34596",
      "kind": "wiki_revision",
      "authority": "secondary_reconstruction",
      "profiles": [
        "retail-final-24.3"
      ],
      "uri": "https://morloch.shadowbaneemulator.com/index.php?title=Power&oldid=34596",
      "revision": "oldid=34596",
      "retrieved_on": "2026-08-29",
      "scope": [
        "power metadata",
        "cast/recycle",
        "target/range",
        "stack category/rank",
        "standard replacement rule"
      ],
      "limitations": [
        "Community reconstruction may simplify exceptions implemented by individual powers or patches.",
        "Exact effect rank versus trained power rank terminology requires data/code cross-checking."
      ],
      "ingestion": {
        "method": "mediawiki_revision",
        "automatable": true,
        "available": true,
        "notes": null
      },
      "capture_status": "remote_pinned",
      "snapshot_path": null,
      "content_sha256": null,
      "content_type": "text/html"
    },
    {
      "source_id": "morloch-formulas-29158",
      "label": "Morloch Formulas revision 29158",
      "kind": "wiki_revision",
      "authority": "secondary_reconstruction",
      "profiles": [
        "retail-final-24.3"
      ],
      "uri": "https://morloch.shadowbaneemulator.com/index.php?title=Formulas&oldid=29158",
      "revision": "oldid=29158",
      "retrieved_on": "2026-08-29",
      "scope": [
        "resistance cap",
        "resistance debuff order",
        "negative resistance",
        "armor piercing formula"
      ],
      "limitations": [
        "Some formulas are marked or described as reconstructions rather than code-derived facts.",